{
  "$schema": "http://json-schema.org/draft-07/schema#",
  "title": "lambda.json",
  "description": "Config file for a Lambda function in the lambdas/ directory. Place this at lambdas/<function-name>/lambda.json.",
  "type": "object",
  "required": ["architecture", "runtime"],
  "properties": {
    "description": {
      "type": "string",
      "description": "Human-readable description shown in the Lambda console."
    },
    "architecture": {
      "type": "string",
      "enum": ["arm64", "x86_64"],
      "description": "CPU architecture. arm64 = Graviton (cheaper, faster). x86_64 = Intel/AMD."
    },
    "runtime": {
      "type": "string",
      "enum": ["provided.al2023", "provided.al2"],
      "description": "Lambda runtime. Use provided.al2023 for Rust/custom runtimes."
    },
    "timeoutSeconds": {
      "type": "integer",
      "default": 30,
      "description": "Lambda timeout in seconds (max 900)."
    },
    "memoryMB": {
      "type": "integer",
      "default": 256,
      "description": "Lambda memory in MB. Also affects CPU allocation proportionally."
    },
    "envVars": {
      "type": "object",
      "description": "Environment variables injected into the Lambda at runtime.",
      "additionalProperties": {
        "oneOf": [
          {
            "type": "string",
            "description": "Literal string value."
          },
          {
            "type": "object",
            "properties": {
              "value": { "type": "string", "description": "Literal string value." },
              "fromStack": {
                "type": "string",
                "enum": ["bucketName", "region", "userPoolId", "userPoolClientId", "apiUrl", "cdnUrl"],
                "description": "Reference a stack output. CDK resolves this at synth time — no hardcoding needed."
              }
            }
          }
        ]
      },
      "examples": [
        {
          "CONTENT_BUCKET": { "fromStack": "bucketName" },
          "S3_BUCKET_REGION": { "fromStack": "region" },
          "COGNITO_USER_POOL_ID": { "fromStack": "userPoolId" },
          "RUST_LOG": "info",
          "SOME_LITERAL": { "value": "hello" }
        }
      ]
    },
    "s3Access": {
      "type": "object",
      "description": "S3 access grants. Keys are bucket prefixes (no trailing slash). Values are arrays of allowed actions.",
      "additionalProperties": {
        "type": "array",
        "items": { "type": "string", "enum": ["get", "put", "delete", "list"] }
      },
      "examples": [
        {
          "content": ["get", "put", "delete"],
          "media": ["get", "put"],
          "downloads": ["get", "list"]
        }
      ]
    },
    "apiGateway": {
      "type": "object",
      "description": "Wires this Lambda to API Gateway. Omit if you don't need an HTTP endpoint.",
      "required": ["path", "methods"],
      "properties": {
        "path": {
          "type": "string",
          "description": "Route path under /api/. E.g. 'update-content' → /api/update-content and /api/update-content/{proxy+}"
        },
        "methods": {
          "type": "array",
          "items": { "type": "string", "enum": ["GET", "POST", "PUT", "PATCH", "DELETE", "OPTIONS"] },
          "description": "HTTP methods to allow. OPTIONS is handled automatically by CORS preflight — you can include it but it's a no-op."
        },
        "cognitoAuthorizer": {
          "type": "boolean",
          "default": true,
          "description": "Attach the Cognito JWT authorizer. The Lambda still checks cognito:groups itself for group-level auth."
        }
      }
    }
  }
}
